{"as_of":"2026-10-23T18:38:18Z","entity_id":"mkt_kalshi_KXNBAPTSLEADER-26OCT23CHIMIL-MILJJAQUEZ24","entity_type":"MARKET","generated_at":"2026-10-23T18:38:18Z","kind":"time_series","links":[{"label":"event","path":"explorer/events/evt_0f62f5b06bdbd95f4ad2.json","rel":"EVENT_RESEARCH","target_id":"evt_0f62f5b06bdbd95f4ad2","target_kind":"event_research"}],"metric_id":"met_nba.model_p_data_only","points":[{"adjusted_value":null,"event_id":"evt_0f62f5b06bdbd95f4ad2","opponent_id":null,"path":"explorer/events/evt_0f62f5b06bdbd95f4ad2.json","quality_status":"RESEARCH","rolling_value":null,"run_id":null,"sample_size":40000,"source":"predictions gate=UNSUPPORTED","t":"2026-10-23T12:15:51Z","value":null,"x":"2026-10-23T12:15:51.389512Z"},{"adjusted_value":null,"event_id":"evt_0f62f5b06bdbd95f4ad2","opponent_id":null,"path":"explorer/events/evt_0f62f5b06bdbd95f4ad2.json","quality_status":"RESEARCH","rolling_value":null,"run_id":null,"sample_size":40000,"source":"predictions gate=UNSUPPORTED","t":"2026-10-23T13:15:57Z","value":null,"x":"2026-10-23T13:15:57.779896Z"},{"adjusted_value":null,"event_id":"evt_0f62f5b06bdbd95f4ad2","opponent_id":null,"path":"explorer/events/evt_0f62f5b06bdbd95f4ad2.json","quality_status":"RESEARCH","rolling_value":null,"run_id":null,"sample_size":40000,"source":"predictions gate=UNSUPPORTED","t":"2026-10-23T14:15:55Z","value":null,"x":"2026-10-23T14:15:55.778500Z"},{"adjusted_value":null,"event_id":"evt_0f62f5b06bdbd95f4ad2","opponent_id":null,"path":"explorer/events/evt_0f62f5b06bdbd95f4ad2.json","quality_status":"RESEARCH","rolling_value":null,"run_id":null,"sample_size":40000,"source":"predictions gate=UNSUPPORTED","t":"2026-10-23T15:15:57Z","value":null,"x":"2026-10-23T15:15:57.727641Z"},{"adjusted_value":null,"event_id":"evt_0f62f5b06bdbd95f4ad2","opponent_id":null,"path":"explorer/events/evt_0f62f5b06bdbd95f4ad2.json","quality_status":"RESEARCH","rolling_value":null,"run_id":null,"sample_size":40000,"source":"predictions gate=UNSUPPORTED","t":"2026-10-23T16:18:25Z","value":null,"x":"2026-10-23T16:18:25.759487Z"},{"adjusted_value":null,"event_id":"evt_0f62f5b06bdbd95f4ad2","opponent_id":null,"path":"explorer/events/evt_0f62f5b06bdbd95f4ad2.json","quality_status":"RESEARCH","rolling_value":null,"run_id":null,"sample_size":40000,"source":"predictions gate=UNSUPPORTED","t":"2026-10-23T17:18:21Z","value":null,"x":"2026-10-23T17:18:21.692442Z"},{"adjusted_value":null,"event_id":"evt_0f62f5b06bdbd95f4ad2","opponent_id":null,"path":"explorer/events/evt_0f62f5b06bdbd95f4ad2.json","quality_status":"RESEARCH","rolling_value":null,"run_id":null,"sample_size":40000,"source":"predictions gate=UNSUPPORTED","t":"2026-10-23T18:18:23Z","value":null,"x":"2026-10-23T18:18:23.559900Z"}],"quality":{"coverage":"4 run(s)","data_as_of":"2026-10-23T18:18:23Z","generated_at":"2026-10-23T18:38:18Z","limitations":["RESEARCH and gated (`CANNOT_TRUST_INPUTS` until official injury report + regular season), and note the §5.14 quote defect until fixed.","§5.14 defect: `workflows/simulate.py:290` strips the captured `*_dollars`/`_quote_cents` quote fields before normalisation, so all 73 contracts of the first real slate carry `p_market = null`, `p_production = null`, and the app export has 0 model prices."],"methodology_version":"nba_edge.research_export/1.0.0 (nba-edge-finder 0.1.0)","missingness":null,"production":true,"sample_size":null,"source":"predictions ledger (data-archive)","source_version":null,"status":"RESEARCH"},"rolling_window":null,"run_id":"run_e9fbd52b8001c1b0344e","schema_version":"edge_finder.app.v1","series_id":"ser_039609c9bd3aafeb0dbf","split":null,"sport":"NBA","unit":"probability","x_axis":"RUN"}
