{"as_of":"2026-10-29T00:59:09Z","entity_id":"mkt_kalshi_KXNBAPRA-26OCT28ORLTOR-ORLFWAGNER22-40","entity_type":"MARKET","generated_at":"2026-10-29T00:59:09Z","kind":"time_series","links":[{"label":"event","path":"explorer/events/evt_4cf82369c14293457654.json","rel":"EVENT_RESEARCH","target_id":"evt_4cf82369c14293457654","target_kind":"event_research"}],"metric_id":"met_nba.model_p_data_only","points":[{"adjusted_value":null,"event_id":"evt_4cf82369c14293457654","opponent_id":null,"path":"explorer/events/evt_4cf82369c14293457654.json","quality_status":"RESEARCH","rolling_value":null,"run_id":null,"sample_size":60000,"source":"predictions gate=NO_EDGE","t":"2026-10-28T07:24:01Z","value":0.19003333333333333,"x":"2026-10-28T07:24:01.995319Z"},{"adjusted_value":null,"event_id":"evt_4cf82369c14293457654","opponent_id":null,"path":"explorer/events/evt_4cf82369c14293457654.json","quality_status":"RESEARCH","rolling_value":null,"run_id":null,"sample_size":60000,"source":"predictions gate=NO_EDGE","t":"2026-10-28T08:35:23Z","value":0.19003333333333333,"x":"2026-10-28T08:35:23.769331Z"},{"adjusted_value":null,"event_id":"evt_4cf82369c14293457654","opponent_id":null,"path":"explorer/events/evt_4cf82369c14293457654.json","quality_status":"RESEARCH","rolling_value":null,"run_id":null,"sample_size":60000,"source":"predictions gate=NO_EDGE","t":"2026-10-28T09:35:30Z","value":0.19003333333333333,"x":"2026-10-28T09:35:30.244913Z"},{"adjusted_value":null,"event_id":"evt_4cf82369c14293457654","opponent_id":null,"path":"explorer/events/evt_4cf82369c14293457654.json","quality_status":"RESEARCH","rolling_value":null,"run_id":null,"sample_size":60000,"source":"predictions gate=NO_EDGE","t":"2026-10-28T10:35:36Z","value":0.19003333333333333,"x":"2026-10-28T10:35:36.776265Z"},{"adjusted_value":null,"event_id":"evt_4cf82369c14293457654","opponent_id":null,"path":"explorer/events/evt_4cf82369c14293457654.json","quality_status":"RESEARCH","rolling_value":null,"run_id":null,"sample_size":60000,"source":"predictions gate=NO_EDGE","t":"2026-10-28T11:35:20Z","value":0.19003333333333333,"x":"2026-10-28T11:35:20.581662Z"},{"adjusted_value":null,"event_id":"evt_4cf82369c14293457654","opponent_id":null,"path":"explorer/events/evt_4cf82369c14293457654.json","quality_status":"RESEARCH","rolling_value":null,"run_id":null,"sample_size":60000,"source":"predictions gate=NO_EDGE","t":"2026-10-28T12:35:24Z","value":0.19003333333333333,"x":"2026-10-28T12:35:24.544046Z"},{"adjusted_value":null,"event_id":"evt_4cf82369c14293457654","opponent_id":null,"path":"explorer/events/evt_4cf82369c14293457654.json","quality_status":"RESEARCH","rolling_value":null,"run_id":null,"sample_size":60000,"source":"predictions gate=NO_EDGE","t":"2026-10-28T13:48:50Z","value":0.19003333333333333,"x":"2026-10-28T13:48:50.661593Z"},{"adjusted_value":null,"event_id":"evt_4cf82369c14293457654","opponent_id":null,"path":"explorer/events/evt_4cf82369c14293457654.json","quality_status":"RESEARCH","rolling_value":null,"run_id":null,"sample_size":60000,"source":"predictions gate=NO_EDGE","t":"2026-10-28T14:48:50Z","value":0.19003333333333333,"x":"2026-10-28T14:48:50.775209Z"},{"adjusted_value":null,"event_id":"evt_4cf82369c14293457654","opponent_id":null,"path":"explorer/events/evt_4cf82369c14293457654.json","quality_status":"RESEARCH","rolling_value":null,"run_id":null,"sample_size":40000,"source":"predictions gate=NO_EDGE","t":"2026-10-28T15:48:48Z","value":0.22745,"x":"2026-10-28T15:48:48.993945Z"},{"adjusted_value":null,"event_id":"evt_4cf82369c14293457654","opponent_id":null,"path":"explorer/events/evt_4cf82369c14293457654.json","quality_status":"RESEARCH","rolling_value":null,"run_id":null,"sample_size":40000,"source":"predictions gate=NO_EDGE","t":"2026-10-28T16:48:51Z","value":0.22745,"x":"2026-10-28T16:48:51.593699Z"},{"adjusted_value":null,"event_id":"evt_4cf82369c14293457654","opponent_id":null,"path":"explorer/events/evt_4cf82369c14293457654.json","quality_status":"RESEARCH","rolling_value":null,"run_id":null,"sample_size":40000,"source":"predictions gate=NO_EDGE","t":"2026-10-28T17:53:49Z","value":0.22745,"x":"2026-10-28T17:53:49.620246Z"},{"adjusted_value":null,"event_id":"evt_4cf82369c14293457654","opponent_id":null,"path":"explorer/events/evt_4cf82369c14293457654.json","quality_status":"RESEARCH","rolling_value":null,"run_id":null,"sample_size":40000,"source":"predictions gate=NO_EDGE","t":"2026-10-28T19:00:46Z","value":0.22745,"x":"2026-10-28T19:00:46.964364Z"},{"adjusted_value":null,"event_id":"evt_4cf82369c14293457654","opponent_id":null,"path":"explorer/events/evt_4cf82369c14293457654.json","quality_status":"RESEARCH","rolling_value":null,"run_id":null,"sample_size":40000,"source":"predictions gate=NO_EDGE","t":"2026-10-28T20:01:38Z","value":0.22745,"x":"2026-10-28T20:01:38.722829Z"},{"adjusted_value":null,"event_id":"evt_4cf82369c14293457654","opponent_id":null,"path":"explorer/events/evt_4cf82369c14293457654.json","quality_status":"RESEARCH","rolling_value":null,"run_id":null,"sample_size":40000,"source":"predictions gate=NO_EDGE","t":"2026-10-28T21:01:39Z","value":0.22745,"x":"2026-10-28T21:01:39.319656Z"},{"adjusted_value":null,"event_id":"evt_4cf82369c14293457654","opponent_id":null,"path":"explorer/events/evt_4cf82369c14293457654.json","quality_status":"RESEARCH","rolling_value":null,"run_id":null,"sample_size":40000,"source":"predictions gate=NO_EDGE","t":"2026-10-28T22:07:30Z","value":0.22745,"x":"2026-10-28T22:07:30.452605Z"},{"adjusted_value":null,"event_id":"evt_4cf82369c14293457654","opponent_id":null,"path":"explorer/events/evt_4cf82369c14293457654.json","quality_status":"RESEARCH","rolling_value":null,"run_id":null,"sample_size":60000,"source":"predictions gate=NO_EDGE","t":"2026-10-28T23:08:55Z","value":0.19003333333333333,"x":"2026-10-28T23:08:55.394978Z"}],"quality":{"coverage":"5 run(s)","data_as_of":"2026-10-29T00:11:46Z","generated_at":"2026-10-29T00:59:09Z","limitations":["RESEARCH and gated (`CANNOT_TRUST_INPUTS` until official injury report + regular season), and note the §5.14 quote defect until fixed.","§5.14 defect: `workflows/simulate.py:290` strips the captured `*_dollars`/`_quote_cents` quote fields before normalisation, so all 73 contracts of the first real slate carry `p_market = null`, `p_production = null`, and the app export has 0 model prices."],"methodology_version":"nba_edge.research_export/1.0.0 (nba-edge-finder 0.1.0)","missingness":null,"production":true,"sample_size":null,"source":"predictions ledger (data-archive)","source_version":null,"status":"RESEARCH"},"rolling_window":null,"run_id":"run_b5e094e643b7c743554b","schema_version":"edge_finder.app.v1","series_id":"ser_da2f3771747f371b0dde","split":null,"sport":"NBA","unit":"probability","x_axis":"RUN"}
