{"as_of":"2026-10-25T19:25:09Z","entity_id":"mkt_kalshi_KXNBA2QTOTAL-26OCT25INDBKN-52","entity_type":"MARKET","generated_at":"2026-10-25T19:25:09Z","kind":"time_series","links":[{"label":"event","path":"explorer/events/evt_5eb9c6b6754461e2e572.json","rel":"EVENT_RESEARCH","target_id":"evt_5eb9c6b6754461e2e572","target_kind":"event_research"}],"metric_id":"met_nba.model_p_data_only","points":[{"adjusted_value":null,"event_id":"evt_5eb9c6b6754461e2e572","opponent_id":null,"path":"explorer/events/evt_5eb9c6b6754461e2e572.json","quality_status":"RESEARCH","rolling_value":null,"run_id":null,"sample_size":40000,"source":"predictions gate=NO_EDGE","t":"2026-10-25T06:24:15Z","value":0.601525,"x":"2026-10-25T06:24:15.778666Z"},{"adjusted_value":null,"event_id":"evt_5eb9c6b6754461e2e572","opponent_id":null,"path":"explorer/events/evt_5eb9c6b6754461e2e572.json","quality_status":"RESEARCH","rolling_value":null,"run_id":null,"sample_size":40000,"source":"predictions gate=NO_EDGE","t":"2026-10-25T07:32:13Z","value":0.601525,"x":"2026-10-25T07:32:13.019001Z"},{"adjusted_value":null,"event_id":"evt_5eb9c6b6754461e2e572","opponent_id":null,"path":"explorer/events/evt_5eb9c6b6754461e2e572.json","quality_status":"RESEARCH","rolling_value":null,"run_id":null,"sample_size":40000,"source":"predictions gate=NO_EDGE","t":"2026-10-25T08:32:11Z","value":0.601525,"x":"2026-10-25T08:32:11.542396Z"},{"adjusted_value":null,"event_id":"evt_5eb9c6b6754461e2e572","opponent_id":null,"path":"explorer/events/evt_5eb9c6b6754461e2e572.json","quality_status":"RESEARCH","rolling_value":null,"run_id":null,"sample_size":40000,"source":"predictions gate=NO_EDGE","t":"2026-10-25T09:32:14Z","value":0.601525,"x":"2026-10-25T09:32:14.231680Z"},{"adjusted_value":null,"event_id":"evt_5eb9c6b6754461e2e572","opponent_id":null,"path":"explorer/events/evt_5eb9c6b6754461e2e572.json","quality_status":"RESEARCH","rolling_value":null,"run_id":null,"sample_size":40000,"source":"predictions gate=NO_EDGE","t":"2026-10-25T10:32:08Z","value":0.601525,"x":"2026-10-25T10:32:08.631108Z"},{"adjusted_value":null,"event_id":"evt_5eb9c6b6754461e2e572","opponent_id":null,"path":"explorer/events/evt_5eb9c6b6754461e2e572.json","quality_status":"RESEARCH","rolling_value":null,"run_id":null,"sample_size":40000,"source":"predictions gate=NO_EDGE","t":"2026-10-25T11:32:11Z","value":0.601525,"x":"2026-10-25T11:32:11.210526Z"},{"adjusted_value":null,"event_id":"evt_5eb9c6b6754461e2e572","opponent_id":null,"path":"explorer/events/evt_5eb9c6b6754461e2e572.json","quality_status":"RESEARCH","rolling_value":null,"run_id":null,"sample_size":40000,"source":"predictions gate=NO_EDGE","t":"2026-10-25T12:34:41Z","value":0.601525,"x":"2026-10-25T12:34:41.937495Z"},{"adjusted_value":null,"event_id":"evt_5eb9c6b6754461e2e572","opponent_id":null,"path":"explorer/events/evt_5eb9c6b6754461e2e572.json","quality_status":"RESEARCH","rolling_value":null,"run_id":null,"sample_size":40000,"source":"predictions gate=NO_EDGE","t":"2026-10-25T13:34:40Z","value":0.601525,"x":"2026-10-25T13:34:40.146415Z"},{"adjusted_value":null,"event_id":"evt_5eb9c6b6754461e2e572","opponent_id":null,"path":"explorer/events/evt_5eb9c6b6754461e2e572.json","quality_status":"RESEARCH","rolling_value":null,"run_id":null,"sample_size":40000,"source":"predictions gate=NO_EDGE","t":"2026-10-25T14:34:40Z","value":0.601525,"x":"2026-10-25T14:34:40.466494Z"},{"adjusted_value":null,"event_id":"evt_5eb9c6b6754461e2e572","opponent_id":null,"path":"explorer/events/evt_5eb9c6b6754461e2e572.json","quality_status":"RESEARCH","rolling_value":null,"run_id":null,"sample_size":40000,"source":"predictions gate=NO_EDGE","t":"2026-10-25T15:34:35Z","value":0.601525,"x":"2026-10-25T15:34:35.672071Z"},{"adjusted_value":null,"event_id":"evt_5eb9c6b6754461e2e572","opponent_id":null,"path":"explorer/events/evt_5eb9c6b6754461e2e572.json","quality_status":"RESEARCH","rolling_value":null,"run_id":null,"sample_size":40000,"source":"predictions gate=NO_EDGE","t":"2026-10-25T16:34:40Z","value":0.601525,"x":"2026-10-25T16:34:40.806027Z"},{"adjusted_value":null,"event_id":"evt_5eb9c6b6754461e2e572","opponent_id":null,"path":"explorer/events/evt_5eb9c6b6754461e2e572.json","quality_status":"RESEARCH","rolling_value":null,"run_id":null,"sample_size":40000,"source":"predictions gate=NO_EDGE","t":"2026-10-25T18:15:17Z","value":0.59925,"x":"2026-10-25T18:15:17.910416Z"},{"adjusted_value":null,"event_id":"evt_5eb9c6b6754461e2e572","opponent_id":null,"path":"explorer/events/evt_5eb9c6b6754461e2e572.json","quality_status":"RESEARCH","rolling_value":null,"run_id":null,"sample_size":40000,"source":"predictions gate=NO_EDGE","t":"2026-10-25T19:15:19Z","value":0.59925,"x":"2026-10-25T19:15:19.140706Z"}],"quality":{"coverage":"4 run(s)","data_as_of":"2026-10-25T19:15:19Z","generated_at":"2026-10-25T19:25:09Z","limitations":["RESEARCH and gated (`CANNOT_TRUST_INPUTS` until official injury report + regular season), and note the §5.14 quote defect until fixed.","§5.14 defect: `workflows/simulate.py:290` strips the captured `*_dollars`/`_quote_cents` quote fields before normalisation, so all 73 contracts of the first real slate carry `p_market = null`, `p_production = null`, and the app export has 0 model prices."],"methodology_version":"nba_edge.research_export/1.0.0 (nba-edge-finder 0.1.0)","missingness":null,"production":true,"sample_size":null,"source":"predictions ledger (data-archive)","source_version":null,"status":"RESEARCH"},"rolling_window":null,"run_id":"run_bc76b4d95b72eca6269d","schema_version":"edge_finder.app.v1","series_id":"ser_87be6f2b3071994fdbae","split":null,"sport":"NBA","unit":"probability","x_axis":"RUN"}
