{"as_of":"2026-10-28T15:03:50Z","entity_id":"mkt_kalshi_KXNBA3PTPROT-26OCT28GSWMIN-GSWDGREEN23-4","entity_type":"MARKET","generated_at":"2026-10-28T15:03:50Z","kind":"time_series","links":[{"label":"event","path":"explorer/events/evt_3425e2a8f4a3ef733f3f.json","rel":"EVENT_RESEARCH","target_id":"evt_3425e2a8f4a3ef733f3f","target_kind":"event_research"}],"metric_id":"met_nba.model_p_data_only","points":[{"adjusted_value":null,"event_id":"evt_3425e2a8f4a3ef733f3f","opponent_id":null,"path":"explorer/events/evt_3425e2a8f4a3ef733f3f.json","quality_status":"RESEARCH","rolling_value":null,"run_id":null,"sample_size":40000,"source":"predictions gate=UNSUPPORTED","t":"2026-10-28T09:35:30Z","value":null,"x":"2026-10-28T09:35:30.244913Z"},{"adjusted_value":null,"event_id":"evt_3425e2a8f4a3ef733f3f","opponent_id":null,"path":"explorer/events/evt_3425e2a8f4a3ef733f3f.json","quality_status":"RESEARCH","rolling_value":null,"run_id":null,"sample_size":40000,"source":"predictions gate=UNSUPPORTED","t":"2026-10-28T10:35:36Z","value":null,"x":"2026-10-28T10:35:36.776265Z"},{"adjusted_value":null,"event_id":"evt_3425e2a8f4a3ef733f3f","opponent_id":null,"path":"explorer/events/evt_3425e2a8f4a3ef733f3f.json","quality_status":"RESEARCH","rolling_value":null,"run_id":null,"sample_size":40000,"source":"predictions gate=UNSUPPORTED","t":"2026-10-28T11:35:20Z","value":null,"x":"2026-10-28T11:35:20.581662Z"},{"adjusted_value":null,"event_id":"evt_3425e2a8f4a3ef733f3f","opponent_id":null,"path":"explorer/events/evt_3425e2a8f4a3ef733f3f.json","quality_status":"RESEARCH","rolling_value":null,"run_id":null,"sample_size":40000,"source":"predictions gate=UNSUPPORTED","t":"2026-10-28T12:35:24Z","value":null,"x":"2026-10-28T12:35:24.544046Z"},{"adjusted_value":null,"event_id":"evt_3425e2a8f4a3ef733f3f","opponent_id":null,"path":"explorer/events/evt_3425e2a8f4a3ef733f3f.json","quality_status":"RESEARCH","rolling_value":null,"run_id":null,"sample_size":40000,"source":"predictions gate=UNSUPPORTED","t":"2026-10-28T13:48:50Z","value":null,"x":"2026-10-28T13:48:50.661593Z"},{"adjusted_value":null,"event_id":"evt_3425e2a8f4a3ef733f3f","opponent_id":null,"path":"explorer/events/evt_3425e2a8f4a3ef733f3f.json","quality_status":"RESEARCH","rolling_value":null,"run_id":null,"sample_size":40000,"source":"predictions gate=UNSUPPORTED","t":"2026-10-28T14:48:50Z","value":null,"x":"2026-10-28T14:48:50.775209Z"}],"quality":{"coverage":"3 run(s)","data_as_of":"2026-10-28T14:48:50Z","generated_at":"2026-10-28T15:03:50Z","limitations":["RESEARCH and gated (`CANNOT_TRUST_INPUTS` until official injury report + regular season), and note the §5.14 quote defect until fixed.","§5.14 defect: `workflows/simulate.py:290` strips the captured `*_dollars`/`_quote_cents` quote fields before normalisation, so all 73 contracts of the first real slate carry `p_market = null`, `p_production = null`, and the app export has 0 model prices."],"methodology_version":"nba_edge.research_export/1.0.0 (nba-edge-finder 0.1.0)","missingness":null,"production":true,"sample_size":null,"source":"predictions ledger (data-archive)","source_version":null,"status":"RESEARCH"},"rolling_window":null,"run_id":"run_576a004826ba7eb4aa70","schema_version":"edge_finder.app.v1","series_id":"ser_471680b7973a30bdae4e","split":null,"sport":"NBA","unit":"probability","x_axis":"RUN"}
