{"as_of":"2026-10-28T09:35:52Z","entity_id":"mkt_kalshi_KXNBAOT-26OCT28NYKCHI-1","entity_type":"MARKET","generated_at":"2026-10-28T09:35:52Z","kind":"time_series","links":[{"label":"event","path":"explorer/events/evt_e1043ec2e4001716a77f.json","rel":"EVENT_RESEARCH","target_id":"evt_e1043ec2e4001716a77f","target_kind":"event_research"}],"metric_id":"met_nba.model_p_data_only","points":[{"adjusted_value":null,"event_id":"evt_e1043ec2e4001716a77f","opponent_id":null,"path":"explorer/events/evt_e1043ec2e4001716a77f.json","quality_status":"RESEARCH","rolling_value":null,"run_id":null,"sample_size":40000,"source":"predictions gate=UNSUPPORTED","t":"2026-10-28T04:24:06Z","value":null,"x":"2026-10-28T04:24:06.694420Z"},{"adjusted_value":null,"event_id":"evt_e1043ec2e4001716a77f","opponent_id":null,"path":"explorer/events/evt_e1043ec2e4001716a77f.json","quality_status":"RESEARCH","rolling_value":null,"run_id":null,"sample_size":40000,"source":"predictions gate=UNSUPPORTED","t":"2026-10-28T05:24:05Z","value":null,"x":"2026-10-28T05:24:05.083999Z"},{"adjusted_value":null,"event_id":"evt_e1043ec2e4001716a77f","opponent_id":null,"path":"explorer/events/evt_e1043ec2e4001716a77f.json","quality_status":"RESEARCH","rolling_value":null,"run_id":null,"sample_size":40000,"source":"predictions gate=UNSUPPORTED","t":"2026-10-28T06:24:06Z","value":null,"x":"2026-10-28T06:24:06.509829Z"},{"adjusted_value":null,"event_id":"evt_e1043ec2e4001716a77f","opponent_id":null,"path":"explorer/events/evt_e1043ec2e4001716a77f.json","quality_status":"RESEARCH","rolling_value":null,"run_id":null,"sample_size":40000,"source":"predictions gate=UNSUPPORTED","t":"2026-10-28T07:24:01Z","value":null,"x":"2026-10-28T07:24:01.995319Z"},{"adjusted_value":null,"event_id":"evt_e1043ec2e4001716a77f","opponent_id":null,"path":"explorer/events/evt_e1043ec2e4001716a77f.json","quality_status":"RESEARCH","rolling_value":null,"run_id":null,"sample_size":40000,"source":"predictions gate=UNSUPPORTED","t":"2026-10-28T08:35:23Z","value":null,"x":"2026-10-28T08:35:23.769331Z"},{"adjusted_value":null,"event_id":"evt_e1043ec2e4001716a77f","opponent_id":null,"path":"explorer/events/evt_e1043ec2e4001716a77f.json","quality_status":"RESEARCH","rolling_value":null,"run_id":null,"sample_size":40000,"source":"predictions gate=UNSUPPORTED","t":"2026-10-28T09:35:30Z","value":null,"x":"2026-10-28T09:35:30.244913Z"}],"quality":{"coverage":"2 run(s)","data_as_of":"2026-10-28T09:35:30Z","generated_at":"2026-10-28T09:35:52Z","limitations":["RESEARCH and gated (`CANNOT_TRUST_INPUTS` until official injury report + regular season), and note the §5.14 quote defect until fixed.","§5.14 defect: `workflows/simulate.py:290` strips the captured `*_dollars`/`_quote_cents` quote fields before normalisation, so all 73 contracts of the first real slate carry `p_market = null`, `p_production = null`, and the app export has 0 model prices."],"methodology_version":"nba_edge.research_export/1.0.0 (nba-edge-finder 0.1.0)","missingness":null,"production":true,"sample_size":null,"source":"predictions ledger (data-archive)","source_version":null,"status":"RESEARCH"},"rolling_window":null,"run_id":"run_196b16d1f32f6d79e734","schema_version":"edge_finder.app.v1","series_id":"ser_d0dd84c559f98af67c8d","split":null,"sport":"NBA","unit":"probability","x_axis":"RUN"}
