{"as_of":"2026-10-29T01:52:48Z","entity_id":"mkt_kalshi_KXNBA2D-26OCT28SASUTA-SASSCASTLE5","entity_type":"MARKET","generated_at":"2026-10-29T01:52:48Z","kind":"time_series","links":[{"label":"event","path":"explorer/events/evt_5c4682ab331e1017109c.json","rel":"EVENT_RESEARCH","target_id":"evt_5c4682ab331e1017109c","target_kind":"event_research"}],"metric_id":"met_nba.model_p_data_only","points":[{"adjusted_value":null,"event_id":"evt_5c4682ab331e1017109c","opponent_id":null,"path":"explorer/events/evt_5c4682ab331e1017109c.json","quality_status":"RESEARCH","rolling_value":null,"run_id":null,"sample_size":40000,"source":"predictions gate=NO_EDGE","t":"2026-10-28T12:35:24Z","value":0.134825,"x":"2026-10-28T12:35:24.544046Z"},{"adjusted_value":null,"event_id":"evt_5c4682ab331e1017109c","opponent_id":null,"path":"explorer/events/evt_5c4682ab331e1017109c.json","quality_status":"RESEARCH","rolling_value":null,"run_id":null,"sample_size":40000,"source":"predictions gate=NO_EDGE","t":"2026-10-28T13:48:50Z","value":0.134825,"x":"2026-10-28T13:48:50.661593Z"},{"adjusted_value":null,"event_id":"evt_5c4682ab331e1017109c","opponent_id":null,"path":"explorer/events/evt_5c4682ab331e1017109c.json","quality_status":"RESEARCH","rolling_value":null,"run_id":null,"sample_size":40000,"source":"predictions gate=NO_EDGE","t":"2026-10-28T14:48:50Z","value":0.134825,"x":"2026-10-28T14:48:50.775209Z"},{"adjusted_value":null,"event_id":"evt_5c4682ab331e1017109c","opponent_id":null,"path":"explorer/events/evt_5c4682ab331e1017109c.json","quality_status":"RESEARCH","rolling_value":null,"run_id":null,"sample_size":40000,"source":"predictions gate=NO_EDGE","t":"2026-10-28T15:48:48Z","value":0.134825,"x":"2026-10-28T15:48:48.993945Z"},{"adjusted_value":null,"event_id":"evt_5c4682ab331e1017109c","opponent_id":null,"path":"explorer/events/evt_5c4682ab331e1017109c.json","quality_status":"RESEARCH","rolling_value":null,"run_id":null,"sample_size":40000,"source":"predictions gate=NO_EDGE","t":"2026-10-28T16:48:51Z","value":0.134825,"x":"2026-10-28T16:48:51.593699Z"},{"adjusted_value":null,"event_id":"evt_5c4682ab331e1017109c","opponent_id":null,"path":"explorer/events/evt_5c4682ab331e1017109c.json","quality_status":"RESEARCH","rolling_value":null,"run_id":null,"sample_size":40000,"source":"predictions gate=NO_EDGE","t":"2026-10-28T17:53:49Z","value":0.134825,"x":"2026-10-28T17:53:49.620246Z"},{"adjusted_value":null,"event_id":"evt_5c4682ab331e1017109c","opponent_id":null,"path":"explorer/events/evt_5c4682ab331e1017109c.json","quality_status":"RESEARCH","rolling_value":null,"run_id":null,"sample_size":40000,"source":"predictions gate=NO_EDGE","t":"2026-10-28T19:00:46Z","value":0.134825,"x":"2026-10-28T19:00:46.964364Z"},{"adjusted_value":null,"event_id":"evt_5c4682ab331e1017109c","opponent_id":null,"path":"explorer/events/evt_5c4682ab331e1017109c.json","quality_status":"RESEARCH","rolling_value":null,"run_id":null,"sample_size":40000,"source":"predictions gate=NO_EDGE","t":"2026-10-28T20:01:38Z","value":0.134825,"x":"2026-10-28T20:01:38.722829Z"},{"adjusted_value":null,"event_id":"evt_5c4682ab331e1017109c","opponent_id":null,"path":"explorer/events/evt_5c4682ab331e1017109c.json","quality_status":"RESEARCH","rolling_value":null,"run_id":null,"sample_size":40000,"source":"predictions gate=NO_EDGE","t":"2026-10-28T21:01:39Z","value":0.134825,"x":"2026-10-28T21:01:39.319656Z"},{"adjusted_value":null,"event_id":"evt_5c4682ab331e1017109c","opponent_id":null,"path":"explorer/events/evt_5c4682ab331e1017109c.json","quality_status":"RESEARCH","rolling_value":null,"run_id":null,"sample_size":40000,"source":"predictions gate=NO_EDGE","t":"2026-10-28T22:07:30Z","value":0.134825,"x":"2026-10-28T22:07:30.452605Z"},{"adjusted_value":null,"event_id":"evt_5c4682ab331e1017109c","opponent_id":null,"path":"explorer/events/evt_5c4682ab331e1017109c.json","quality_status":"RESEARCH","rolling_value":null,"run_id":null,"sample_size":40000,"source":"predictions gate=NO_EDGE","t":"2026-10-28T23:08:55Z","value":0.134825,"x":"2026-10-28T23:08:55.394978Z"},{"adjusted_value":null,"event_id":"evt_5c4682ab331e1017109c","opponent_id":null,"path":"explorer/events/evt_5c4682ab331e1017109c.json","quality_status":"RESEARCH","rolling_value":null,"run_id":null,"sample_size":40000,"source":"predictions gate=NO_EDGE","t":"2026-10-29T00:11:46Z","value":0.114925,"x":"2026-10-29T00:11:46.553873Z"}],"quality":{"coverage":"5 run(s)","data_as_of":"2026-10-29T00:11:46Z","generated_at":"2026-10-29T01:52:48Z","limitations":["RESEARCH and gated (`CANNOT_TRUST_INPUTS` until official injury report + regular season), and note the §5.14 quote defect until fixed.","§5.14 defect: `workflows/simulate.py:290` strips the captured `*_dollars`/`_quote_cents` quote fields before normalisation, so all 73 contracts of the first real slate carry `p_market = null`, `p_production = null`, and the app export has 0 model prices."],"methodology_version":"nba_edge.research_export/1.0.0 (nba-edge-finder 0.1.0)","missingness":null,"production":true,"sample_size":null,"source":"predictions ledger (data-archive)","source_version":null,"status":"RESEARCH"},"rolling_window":null,"run_id":"run_1b051d8d71983a1a7df3","schema_version":"edge_finder.app.v1","series_id":"ser_61d32d9c1b71527474ea","split":null,"sport":"NBA","unit":"probability","x_axis":"RUN"}
