{"as_of":"2026-10-25T00:18:51Z","entity_id":"mkt_kalshi_KXNBAREBPROT-26OCT24MIACHA-MIAKTHOMPSON11-8","entity_type":"MARKET","generated_at":"2026-10-25T00:18:51Z","kind":"time_series","links":[{"label":"event","path":"explorer/events/evt_0da6db332a3756c4b52f.json","rel":"EVENT_RESEARCH","target_id":"evt_0da6db332a3756c4b52f","target_kind":"event_research"}],"metric_id":"met_nba.model_p_data_only","points":[{"adjusted_value":null,"event_id":"evt_0da6db332a3756c4b52f","opponent_id":null,"path":"explorer/events/evt_0da6db332a3756c4b52f.json","quality_status":"RESEARCH","rolling_value":null,"run_id":null,"sample_size":40000,"source":"predictions gate=UNSUPPORTED","t":"2026-10-24T15:53:53Z","value":null,"x":"2026-10-24T15:53:53.848729Z"},{"adjusted_value":null,"event_id":"evt_0da6db332a3756c4b52f","opponent_id":null,"path":"explorer/events/evt_0da6db332a3756c4b52f.json","quality_status":"RESEARCH","rolling_value":null,"run_id":null,"sample_size":40000,"source":"predictions gate=UNSUPPORTED","t":"2026-10-24T16:57:25Z","value":null,"x":"2026-10-24T16:57:25.815427Z"},{"adjusted_value":null,"event_id":"evt_0da6db332a3756c4b52f","opponent_id":null,"path":"explorer/events/evt_0da6db332a3756c4b52f.json","quality_status":"RESEARCH","rolling_value":null,"run_id":null,"sample_size":40000,"source":"predictions gate=UNSUPPORTED","t":"2026-10-24T17:57:23Z","value":null,"x":"2026-10-24T17:57:23.868226Z"},{"adjusted_value":null,"event_id":"evt_0da6db332a3756c4b52f","opponent_id":null,"path":"explorer/events/evt_0da6db332a3756c4b52f.json","quality_status":"RESEARCH","rolling_value":null,"run_id":null,"sample_size":40000,"source":"predictions gate=UNSUPPORTED","t":"2026-10-24T18:57:21Z","value":null,"x":"2026-10-24T18:57:21.273856Z"},{"adjusted_value":null,"event_id":"evt_0da6db332a3756c4b52f","opponent_id":null,"path":"explorer/events/evt_0da6db332a3756c4b52f.json","quality_status":"RESEARCH","rolling_value":null,"run_id":null,"sample_size":40000,"source":"predictions gate=UNSUPPORTED","t":"2026-10-24T19:57:25Z","value":null,"x":"2026-10-24T19:57:25.812459Z"},{"adjusted_value":null,"event_id":"evt_0da6db332a3756c4b52f","opponent_id":null,"path":"explorer/events/evt_0da6db332a3756c4b52f.json","quality_status":"RESEARCH","rolling_value":null,"run_id":null,"sample_size":40000,"source":"predictions gate=UNSUPPORTED","t":"2026-10-24T21:05:17Z","value":null,"x":"2026-10-24T21:05:17.783399Z"}],"quality":{"coverage":"5 run(s)","data_as_of":"2026-10-25T00:05:45Z","generated_at":"2026-10-25T00:18:51Z","limitations":["RESEARCH and gated (`CANNOT_TRUST_INPUTS` until official injury report + regular season), and note the §5.14 quote defect until fixed.","§5.14 defect: `workflows/simulate.py:290` strips the captured `*_dollars`/`_quote_cents` quote fields before normalisation, so all 73 contracts of the first real slate carry `p_market = null`, `p_production = null`, and the app export has 0 model prices."],"methodology_version":"nba_edge.research_export/1.0.0 (nba-edge-finder 0.1.0)","missingness":null,"production":true,"sample_size":null,"source":"predictions ledger (data-archive)","source_version":null,"status":"RESEARCH"},"rolling_window":null,"run_id":"run_1e8b282af57a8bc490f1","schema_version":"edge_finder.app.v1","series_id":"ser_b65f1543e005428d0d0e","split":null,"sport":"NBA","unit":"probability","x_axis":"RUN"}
