{"as_of":"2026-10-30T06:38:57Z","entity_id":"mkt_kalshi_KXNBATEAMTOTAL-26OCT30HOUDAL-DAL116","entity_type":"MARKET","generated_at":"2026-10-30T06:38:57Z","kind":"time_series","links":[{"label":"event","path":"explorer/events/evt_ab35135c13325495d75d.json","rel":"EVENT_RESEARCH","target_id":"evt_ab35135c13325495d75d","target_kind":"event_research"}],"metric_id":"met_nba.model_p_data_only","points":[{"adjusted_value":null,"event_id":"evt_ab35135c13325495d75d","opponent_id":null,"path":"explorer/events/evt_ab35135c13325495d75d.json","quality_status":"RESEARCH","rolling_value":null,"run_id":null,"sample_size":40000,"source":"predictions gate=NO_EDGE","t":"2026-10-30T04:47:50Z","value":0.18805,"x":"2026-10-30T04:47:50.822264Z"},{"adjusted_value":null,"event_id":"evt_ab35135c13325495d75d","opponent_id":null,"path":"explorer/events/evt_ab35135c13325495d75d.json","quality_status":"RESEARCH","rolling_value":null,"run_id":null,"sample_size":40000,"source":"predictions gate=NO_EDGE","t":"2026-10-30T05:53:59Z","value":0.18805,"x":"2026-10-30T05:53:59.613016Z"}],"quality":{"coverage":"2 run(s)","data_as_of":"2026-10-30T05:53:59Z","generated_at":"2026-10-30T06:38:57Z","limitations":["RESEARCH and gated (`CANNOT_TRUST_INPUTS` until official injury report + regular season), and note the §5.14 quote defect until fixed.","§5.14 defect: `workflows/simulate.py:290` strips the captured `*_dollars`/`_quote_cents` quote fields before normalisation, so all 73 contracts of the first real slate carry `p_market = null`, `p_production = null`, and the app export has 0 model prices."],"methodology_version":"nba_edge.research_export/1.0.0 (nba-edge-finder 0.1.0)","missingness":null,"production":true,"sample_size":null,"source":"predictions ledger (data-archive)","source_version":null,"status":"RESEARCH"},"rolling_window":null,"run_id":"run_692854806fb7eae31d19","schema_version":"edge_finder.app.v1","series_id":"ser_0e2d850619330199e14c","split":null,"sport":"NBA","unit":"probability","x_axis":"RUN"}
