{"as_of":"2026-10-23T17:28:15Z","entity_id":"mkt_kalshi_KXNBAPTS-26OCT23DALIND-INDIZUBAC40-15","entity_type":"MARKET","generated_at":"2026-10-23T17:28:15Z","kind":"time_series","links":[{"label":"event","path":"explorer/events/evt_e7cafc8ec79cbbd504b2.json","rel":"EVENT_RESEARCH","target_id":"evt_e7cafc8ec79cbbd504b2","target_kind":"event_research"}],"metric_id":"met_nba.model_p_data_only","points":[{"adjusted_value":null,"event_id":"evt_e7cafc8ec79cbbd504b2","opponent_id":null,"path":"explorer/events/evt_e7cafc8ec79cbbd504b2.json","quality_status":"RESEARCH","rolling_value":null,"run_id":null,"sample_size":40000,"source":"predictions gate=NO_EDGE","t":"2026-10-23T04:10:51Z","value":0.1003,"x":"2026-10-23T04:10:51.632718Z"},{"adjusted_value":null,"event_id":"evt_e7cafc8ec79cbbd504b2","opponent_id":null,"path":"explorer/events/evt_e7cafc8ec79cbbd504b2.json","quality_status":"RESEARCH","rolling_value":null,"run_id":null,"sample_size":40000,"source":"predictions gate=NO_EDGE","t":"2026-10-23T05:10:44Z","value":0.1003,"x":"2026-10-23T05:10:44.777185Z"},{"adjusted_value":null,"event_id":"evt_e7cafc8ec79cbbd504b2","opponent_id":null,"path":"explorer/events/evt_e7cafc8ec79cbbd504b2.json","quality_status":"RESEARCH","rolling_value":null,"run_id":null,"sample_size":40000,"source":"predictions gate=NO_EDGE","t":"2026-10-23T06:09:04Z","value":0.1003,"x":"2026-10-23T06:09:04.447800Z"},{"adjusted_value":null,"event_id":"evt_e7cafc8ec79cbbd504b2","opponent_id":null,"path":"explorer/events/evt_e7cafc8ec79cbbd504b2.json","quality_status":"RESEARCH","rolling_value":null,"run_id":null,"sample_size":40000,"source":"predictions gate=NO_EDGE","t":"2026-10-23T07:09:08Z","value":0.1003,"x":"2026-10-23T07:09:08.816424Z"},{"adjusted_value":null,"event_id":"evt_e7cafc8ec79cbbd504b2","opponent_id":null,"path":"explorer/events/evt_e7cafc8ec79cbbd504b2.json","quality_status":"RESEARCH","rolling_value":null,"run_id":null,"sample_size":40000,"source":"predictions gate=NO_EDGE","t":"2026-10-23T08:09:15Z","value":0.1003,"x":"2026-10-23T08:09:15.047892Z"},{"adjusted_value":null,"event_id":"evt_e7cafc8ec79cbbd504b2","opponent_id":null,"path":"explorer/events/evt_e7cafc8ec79cbbd504b2.json","quality_status":"RESEARCH","rolling_value":null,"run_id":null,"sample_size":40000,"source":"predictions gate=NO_EDGE","t":"2026-10-23T09:09:10Z","value":0.1003,"x":"2026-10-23T09:09:10.357812Z"},{"adjusted_value":null,"event_id":"evt_e7cafc8ec79cbbd504b2","opponent_id":null,"path":"explorer/events/evt_e7cafc8ec79cbbd504b2.json","quality_status":"RESEARCH","rolling_value":null,"run_id":null,"sample_size":40000,"source":"predictions gate=NO_EDGE","t":"2026-10-23T10:09:14Z","value":0.1003,"x":"2026-10-23T10:09:14.746218Z"},{"adjusted_value":null,"event_id":"evt_e7cafc8ec79cbbd504b2","opponent_id":null,"path":"explorer/events/evt_e7cafc8ec79cbbd504b2.json","quality_status":"RESEARCH","rolling_value":null,"run_id":null,"sample_size":40000,"source":"predictions gate=NO_EDGE","t":"2026-10-23T11:15:54Z","value":0.1003,"x":"2026-10-23T11:15:54.587664Z"},{"adjusted_value":null,"event_id":"evt_e7cafc8ec79cbbd504b2","opponent_id":null,"path":"explorer/events/evt_e7cafc8ec79cbbd504b2.json","quality_status":"RESEARCH","rolling_value":null,"run_id":null,"sample_size":40000,"source":"predictions gate=NO_EDGE","t":"2026-10-23T12:15:51Z","value":0.1003,"x":"2026-10-23T12:15:51.389512Z"},{"adjusted_value":null,"event_id":"evt_e7cafc8ec79cbbd504b2","opponent_id":null,"path":"explorer/events/evt_e7cafc8ec79cbbd504b2.json","quality_status":"RESEARCH","rolling_value":null,"run_id":null,"sample_size":40000,"source":"predictions gate=NO_EDGE","t":"2026-10-23T13:15:57Z","value":0.1003,"x":"2026-10-23T13:15:57.779896Z"},{"adjusted_value":null,"event_id":"evt_e7cafc8ec79cbbd504b2","opponent_id":null,"path":"explorer/events/evt_e7cafc8ec79cbbd504b2.json","quality_status":"RESEARCH","rolling_value":null,"run_id":null,"sample_size":40000,"source":"predictions gate=NO_EDGE","t":"2026-10-23T14:15:55Z","value":0.1003,"x":"2026-10-23T14:15:55.778500Z"},{"adjusted_value":null,"event_id":"evt_e7cafc8ec79cbbd504b2","opponent_id":null,"path":"explorer/events/evt_e7cafc8ec79cbbd504b2.json","quality_status":"RESEARCH","rolling_value":null,"run_id":null,"sample_size":40000,"source":"predictions gate=NO_EDGE","t":"2026-10-23T15:15:57Z","value":0.1003,"x":"2026-10-23T15:15:57.727641Z"},{"adjusted_value":null,"event_id":"evt_e7cafc8ec79cbbd504b2","opponent_id":null,"path":"explorer/events/evt_e7cafc8ec79cbbd504b2.json","quality_status":"RESEARCH","rolling_value":null,"run_id":null,"sample_size":40000,"source":"predictions gate=NO_EDGE","t":"2026-10-23T16:18:25Z","value":0.1003,"x":"2026-10-23T16:18:25.759487Z"},{"adjusted_value":null,"event_id":"evt_e7cafc8ec79cbbd504b2","opponent_id":null,"path":"explorer/events/evt_e7cafc8ec79cbbd504b2.json","quality_status":"RESEARCH","rolling_value":null,"run_id":null,"sample_size":40000,"source":"predictions gate=NO_EDGE","t":"2026-10-23T17:18:21Z","value":0.1003,"x":"2026-10-23T17:18:21.692442Z"}],"quality":{"coverage":"4 run(s)","data_as_of":"2026-10-23T17:18:21Z","generated_at":"2026-10-23T17:28:15Z","limitations":["RESEARCH and gated (`CANNOT_TRUST_INPUTS` until official injury report + regular season), and note the §5.14 quote defect until fixed.","§5.14 defect: `workflows/simulate.py:290` strips the captured `*_dollars`/`_quote_cents` quote fields before normalisation, so all 73 contracts of the first real slate carry `p_market = null`, `p_production = null`, and the app export has 0 model prices."],"methodology_version":"nba_edge.research_export/1.0.0 (nba-edge-finder 0.1.0)","missingness":null,"production":true,"sample_size":null,"source":"predictions ledger (data-archive)","source_version":null,"status":"RESEARCH"},"rolling_window":null,"run_id":"run_b87028faf3dd8b72de7e","schema_version":"edge_finder.app.v1","series_id":"ser_fbf0d9b7c1f1fdc020b3","split":null,"sport":"NBA","unit":"probability","x_axis":"RUN"}
