{"as_of":"2026-10-26T13:06:15Z","entity_id":"mkt_kalshi_KXNBAAST-26OCT26CHIBOS-CHIJGIDDEY3-10","entity_type":"MARKET","generated_at":"2026-10-26T13:06:15Z","kind":"time_series","links":[{"label":"event","path":"explorer/events/evt_35ed1062cfeba9ce5e2c.json","rel":"EVENT_RESEARCH","target_id":"evt_35ed1062cfeba9ce5e2c","target_kind":"event_research"}],"metric_id":"met_nba.model_p_data_only","points":[{"adjusted_value":null,"event_id":"evt_35ed1062cfeba9ce5e2c","opponent_id":null,"path":"explorer/events/evt_35ed1062cfeba9ce5e2c.json","quality_status":"RESEARCH","rolling_value":null,"run_id":null,"sample_size":40000,"source":"predictions gate=NO_EDGE","t":"2026-10-26T06:13:00Z","value":0.1232,"x":"2026-10-26T06:13:00.552025Z"},{"adjusted_value":null,"event_id":"evt_35ed1062cfeba9ce5e2c","opponent_id":null,"path":"explorer/events/evt_35ed1062cfeba9ce5e2c.json","quality_status":"RESEARCH","rolling_value":null,"run_id":null,"sample_size":40000,"source":"predictions gate=NO_EDGE","t":"2026-10-26T07:13:04Z","value":0.1232,"x":"2026-10-26T07:13:04.140729Z"},{"adjusted_value":null,"event_id":"evt_35ed1062cfeba9ce5e2c","opponent_id":null,"path":"explorer/events/evt_35ed1062cfeba9ce5e2c.json","quality_status":"RESEARCH","rolling_value":null,"run_id":null,"sample_size":40000,"source":"predictions gate=NO_EDGE","t":"2026-10-26T08:13:06Z","value":0.1232,"x":"2026-10-26T08:13:06.189724Z"},{"adjusted_value":null,"event_id":"evt_35ed1062cfeba9ce5e2c","opponent_id":null,"path":"explorer/events/evt_35ed1062cfeba9ce5e2c.json","quality_status":"RESEARCH","rolling_value":null,"run_id":null,"sample_size":40000,"source":"predictions gate=NO_EDGE","t":"2026-10-26T09:13:05Z","value":0.1232,"x":"2026-10-26T09:13:05.298482Z"},{"adjusted_value":null,"event_id":"evt_35ed1062cfeba9ce5e2c","opponent_id":null,"path":"explorer/events/evt_35ed1062cfeba9ce5e2c.json","quality_status":"RESEARCH","rolling_value":null,"run_id":null,"sample_size":40000,"source":"predictions gate=NO_EDGE","t":"2026-10-26T10:21:23Z","value":0.1232,"x":"2026-10-26T10:21:23.026055Z"},{"adjusted_value":null,"event_id":"evt_35ed1062cfeba9ce5e2c","opponent_id":null,"path":"explorer/events/evt_35ed1062cfeba9ce5e2c.json","quality_status":"RESEARCH","rolling_value":null,"run_id":null,"sample_size":40000,"source":"predictions gate=NO_EDGE","t":"2026-10-26T11:21:13Z","value":0.1232,"x":"2026-10-26T11:21:13.534219Z"},{"adjusted_value":null,"event_id":"evt_35ed1062cfeba9ce5e2c","opponent_id":null,"path":"explorer/events/evt_35ed1062cfeba9ce5e2c.json","quality_status":"RESEARCH","rolling_value":null,"run_id":null,"sample_size":40000,"source":"predictions gate=NO_EDGE","t":"2026-10-26T12:21:14Z","value":0.1232,"x":"2026-10-26T12:21:14.788335Z"}],"quality":{"coverage":"3 run(s)","data_as_of":"2026-10-26T12:21:14Z","generated_at":"2026-10-26T13:06:15Z","limitations":["RESEARCH and gated (`CANNOT_TRUST_INPUTS` until official injury report + regular season), and note the §5.14 quote defect until fixed.","§5.14 defect: `workflows/simulate.py:290` strips the captured `*_dollars`/`_quote_cents` quote fields before normalisation, so all 73 contracts of the first real slate carry `p_market = null`, `p_production = null`, and the app export has 0 model prices."],"methodology_version":"nba_edge.research_export/1.0.0 (nba-edge-finder 0.1.0)","missingness":null,"production":true,"sample_size":null,"source":"predictions ledger (data-archive)","source_version":null,"status":"RESEARCH"},"rolling_window":null,"run_id":"run_ec5d8540410ea96bf7a5","schema_version":"edge_finder.app.v1","series_id":"ser_47c8b5bee34e0b51f687","split":null,"sport":"NBA","unit":"probability","x_axis":"RUN"}
